<?xml version="1.0" encoding="utf-8"?>
<xs:schema xmlns:xs="http://www.w3.org/2001/XMLSchema">
    <xs:element name="scene" type="TScene">
    </xs:element>
    <xs:complexType name="TScene">
        <xs:all>
            <xs:element name="storage" minOccurs="0">
                <xs:complexType>
                    <xs:sequence minOccurs="0" maxOccurs="unbounded">
                        <xs:element name="script" minOccurs="0" maxOccurs="unbounded">
                            <xs:complexType>
                                <xs:complexContent>
                                    <xs:extension base="TScript">
                                        <xs:attribute name="name" type="xs:string" />                                        
                                    </xs:extension>
                                </xs:complexContent>
                            </xs:complexType>
                        </xs:element>
                        <xs:element name="item" minOccurs="0" maxOccurs="unbounded">
                            <xs:complexType>
                                <xs:attribute name="art" type="art" use="required" />
                                <xs:attribute name="description" type="xs:string" use="required" />
                            </xs:complexType>
                        </xs:element>
                    </xs:sequence>
                </xs:complexType>
            </xs:element>
            <xs:element name="minimapBase" type="art" minOccurs="0" />
            <xs:element name="minimap" type="art" minOccurs="0" />
            <xs:element name="scenes" minOccurs="0">
                <xs:complexType>
                    <xs:sequence>
                        <xs:element name="scene" maxOccurs="unbounded">
                            <xs:complexType>
                                <xs:complexContent>
                                    <xs:extension base="TScene">
                                        <xs:attribute name="name" type="xs:string" />
                                    </xs:extension>
                                </xs:complexContent>
                            </xs:complexType>
                        </xs:element>
                    </xs:sequence>
                </xs:complexType>
            </xs:element>
            <xs:element name="backgrounds" type="arts" minOccurs="0" />
            <xs:element name="directions" minOccurs="0">
                <xs:complexType>
                    <xs:all>
                        <xs:element name="turnaround" type="TScript" minOccurs="0" />
                        <xs:element name="right" type="TScript" minOccurs="0" />
                        <xs:element name="left" type="TScript" minOccurs="0" />
                    </xs:all>
                </xs:complexType>
            </xs:element>
            <xs:element name="enter" type="TScript" minOccurs="0"/>
            <xs:element name="items" minOccurs="0">
                <xs:complexType>
                    <xs:sequence>
                        <xs:element name="interactible" type="interactible" minOccurs="0" maxOccurs="unbounded" />
                    </xs:sequence>
                </xs:complexType>
            </xs:element>
        </xs:all>
        <xs:attribute name="type" type="xs:string" use="optional" />
        <xs:attribute name="escapeToTurnaround" use="optional">
            <xs:simpleType>
                <xs:restriction base="xs:string">
                    <xs:enumeration value="true" />
                </xs:restriction>
            </xs:simpleType>
        </xs:attribute>
    </xs:complexType>
    <xs:simpleType name="art">
        <xs:restriction base="xs:string" />
    </xs:simpleType>
    <xs:complexType name="arts">
        <xs:sequence>
            <xs:element name="art" type="art" maxOccurs="unbounded" />
        </xs:sequence>
    </xs:complexType>
    <xs:complexType name="interactible">
        <xs:sequence>
            <xs:element name="rectangle" type="xs:string" />
            <xs:element name="first" type="interaction" minOccurs="1" />
            <xs:element name="second" type="interaction" minOccurs="0" />
            <xs:element name="itemuse" minOccurs="0">
                <xs:complexType>
                    <xs:sequence>
                        <xs:element name="failure" minOccurs="0" maxOccurs="1" type="TScript" />
                        <xs:element name="withItem" minOccurs="0" maxOccurs="unbounded">
                            <xs:complexType>
                                <xs:complexContent>
                                    <xs:extension base="TScript">
                                        <xs:attribute name="art" type="art" use="required" />
                                    </xs:extension>
                                </xs:complexContent>
                            </xs:complexType>
                        </xs:element>
                    </xs:sequence>
                    <xs:attribute name="failure" type="xs:string" />
                </xs:complexType>
            </xs:element>
        </xs:sequence>
        <xs:attribute name="name" type="xs:string" use="required" />
        <xs:attribute name="art" type="art" />
    </xs:complexType>
    <xs:complexType name="interaction" >
        <xs:complexContent>
            <xs:extension base="TScript">
                <xs:attribute name="think" type="xs:string" /> 
            </xs:extension>
        </xs:complexContent>
    </xs:complexType>
    <xs:complexType name="TScript">
        <xs:sequence>
            <xs:choice minOccurs="0" maxOccurs="unbounded">
                <xs:element name="goToRoom" type="xs:string"/>
                <xs:element name="think" type="xs:string" />
                <xs:element name="popScene">
                    <xs:complexType>
                    </xs:complexType>
                </xs:element>
                <xs:element name="addToInventory">
                    <xs:complexType>
                        <xs:attribute name="art" type="art" use="required" />
                        <xs:attribute name="description" type="xs:string" use="required" />
                    </xs:complexType>
                </xs:element>
                <xs:element name="destroyInteractible">
                    <xs:complexType>
                        <xs:attribute name="name" type="xs:string" use="required" />
                    </xs:complexType>
                </xs:element>
                <xs:element name="pushScene">
                    <xs:complexType>
                        <xs:attribute name="name" type="xs:string" use="required" />
                    </xs:complexType>
                </xs:element>
                <xs:element name="s">
                    <xs:complexType>
                        <xs:complexContent>
                            <xs:extension base="xs:integer">
                                <xs:attribute name="speaker" type="character" use="required" />
                                <xs:attribute name="pose" type="pose" />
                            </xs:extension>
                        </xs:complexContent>
                    </xs:complexType>
                </xs:element>
                <xs:element name="removeHeldItem">
                    <xs:complexType>                        
                    </xs:complexType>
                </xs:element>
                <xs:element name="setInteractibleFirstAndSecondUse">
                    <xs:complexType>
                        <xs:complexContent>
                            <xs:extension base="TScript">
                                <xs:attribute name="interactible" type="xs:string" use="required" />
                            </xs:extension>
                        </xs:complexContent>
                    </xs:complexType>
                </xs:element>

                <xs:element name="setInteractibleArt">
                    <xs:complexType>                        
                        <xs:attribute name="interactible" type="xs:string" use="required" />
                        <xs:attribute name="art" type="art" use="required" />
                    </xs:complexType>
                </xs:element>
                <xs:element name="setFlag">
                    <xs:complexType>
                        <xs:attribute name="flag" type="xs:string" use="required" />
                    </xs:complexType>
                </xs:element>
                <xs:element name="ifFlag">
                    <xs:complexType>
                        <xs:sequence>
                            <xs:element name="then" type="TScript" />
                            <xs:element name="else" type="TScript" />
                        </xs:sequence>
                        <xs:attribute name="flag" use="required" />
                    </xs:complexType>
                </xs:element>
                <xs:element name="removeBackgroundArt">
                    <xs:complexType>
                        <xs:attribute name="art" type="art" />
                    </xs:complexType>
                </xs:element>
                <xs:element name="addBackgroundArt">
                    <xs:complexType>
                        <xs:attribute name="art" type="art" />
                    </xs:complexType>
                </xs:element>
                <xs:element name="enqueue">
                    <xs:complexType>
                        <xs:attribute name="bookmark" type="xs:string" />
                    </xs:complexType>
                </xs:element>
                <xs:element name="pushFullArtScene">
                    <xs:complexType>
                        <xs:attribute name="art" type="art" use="required" />
                    </xs:complexType>
                </xs:element>
                <xs:element name="knownAction">
                    <xs:complexType>
                        <xs:attribute name="action" type="xs:string" />
                    </xs:complexType>
                </xs:element>
                <xs:element name="replaceHeldItem">
                    <xs:annotation>
                        <xs:documentation>
                            Replaces the currently held inventory item by a new item with the given art and description.
                        </xs:documentation>
                    </xs:annotation>
                    <xs:complexType>
                        <xs:attribute name="with" type="art" use="required">
                            <xs:annotation>
                                <xs:documentation>
                                    The name of the art of the new replacement item.
                                </xs:documentation>
                            </xs:annotation>
                        </xs:attribute>
                        <xs:attribute name="withDescription" type="xs:string" use="required" />
                    </xs:complexType>
                </xs:element>
            </xs:choice>
        </xs:sequence>
    </xs:complexType>
    <xs:simpleType name="character">
        <xs:restriction>
            <xs:enumeration value="Tišík" />
            <xs:enumeration value="Vědátor" />
            <xs:enumeration value="Vypravěč" />
            <xs:enumeration value="Lenka" />
            <xs:enumeration value="Smíšek" />
            <xs:enumeration value="Háthí" />
        </xs:restriction>
    </xs:simpleType>
    <xs:simpleType name="pose">
        <xs:restriction>
            <xs:enumeration value="thinking" />
            <xs:enumeration value="speaking" />
            <xs:enumeration value="excited" />
            <xs:enumeration value="pointing" />
            <xs:enumeration value="amused" />
            <xs:enumeration value="angry" />
            <xs:enumeration value="afraid" />
            <xs:enumeration value="normal" />
            <xs:enumeration value="shrugging" />
            <xs:enumeration value="determined" />
            <xs:enumeration value="blushing" />
        </xs:restriction>
    </xs:simpleType>
    <xs:simpleType name="nonEmptyString">
        <xs:restriction base="xs:string">
            <xs:minLength value="1" />
            <xs:pattern value="A.+" />
        </xs:restriction>
    </xs:simpleType>
</xs:schema>