<?xml version="1.0" encoding="utf-8"?>
<!--<scene>-->
<scene xmlns:xsi="http://www.w3.org/2001/XMLSchema-instance" xsi:noNamespaceSchemaLocation="../scene.xsd">
    <enter>
        <pushScene name="Outside" />
    </enter>
    <scenes>
        <scene name="Outside">
            <backgrounds>
                <art>Overshot</art>
            </backgrounds>
            <enter>
                <s speaker="Tišík" pose="speaking">"Naší snahou nejlepší buď čin" je heslo vlčat.</s>
                <s speaker="Tišík" pose="thinking">Jak mi to vysvětloval Akela, tak znamená, že bych se měl snažit vždy co nejvíc dokážu.</s>
                <s speaker="Tišík" pose="speaking">Já - i ostatní vlčata a světlušky - se snažíme. </s>
                <s speaker="Tišík" pose="speaking">Ale Akela říkal, že tento víkend zažijeme dobrodružství, ve kterém se teprve ukáže, z čeho jsme.</s>
                <s speaker="Tišík" pose="determined">Podařilo se mu totiž pro nás zajistit víkend na zámku Duchov.</s>
                <zoomInto rectangle="888,96,1032,671" time="12" />
                <think>Zámek Duchov. Už za středověku byl opředený pověstmi a v moderní době byl sídlem přísně tajného vládního projektu.</think>
                <think>Také můj taťka byl výzkumníkem na tomto projektu.</think>
                <think>Ale před sedmi lety taťka {b}zmizel.{/b} Jednoho dne se z práce už nevrátil.</think>
                <think>Projekt byl ukončen, a zámek zapovězen.</think>
                <think>Ale dnes se vracíme! Já, Vědátor, Vypravěč, holky a Akela, budeme mít celý zámek jen sami pro sebe!</think>
                <think>Bude to dobrodružství, a... těším se! Ale taky se bojím.</think>
                <zoomInto rectangle="0,0,1920,1080" time="4" />
                <addBackgroundArt art="MainLogoCzech" />
                <think>Mám takové tušení, že tohle nebude úplně obvyklá skautská výprava...</think>
                <removeBackgroundArt art="MainLogoCzech" />
                <removeBackgroundArt art="Overshot" />
                <addBackgroundArt art="CourtyardDemo" />             
                <zoomInto rectangle="0,0,1920,1080" time="1" />
                <s speaker="Akela" pose="excited">Vlčata a světlušky! Vítejte na nádvoří zámku Duchov!</s>
                <s speaker="Vlčata a světlušky" pose="excited">Jupí!!!</s>
                <s speaker="Smíšek" pose="afraid">Já musím na záchod!</s>
                <s speaker="Lenka" pose="determined">Jestli jde Smíšek, tak já taky!</s>
                <s speaker="Akela" pose="pointing">Fajn, fajn. Záchody jsou tímto směrem.</s>
                <s speaker="Vypravěč" pose="pointing">Můžeme k jezírku?</s>
                <s speaker="Vědátor" pose="pointing">Oooh, tamhle je rytířské brnění!</s>
                <s speaker="Tišík" pose="pointing">Jdu se podívat do studny!</s>
                <s speaker="Akela" pose="angry">Tak počkejte chvilku, kluci! Žádný rozchod tady není.</s>
                <s speaker="Akela" pose="speaking">Já půjdu do hradu nahodit elektřinu, a vy na mě zatím počkejte ve strážnici.</s>
                <s speaker="Akela" pose="determined">Žádné jezírko, žádná studna, nikam nechoďte sami, jasný? Sedm let tu nikdo nebyl, všechno může být nebezpečné.</s>
                <s speaker="Tišík" pose="speaking">(zklamaně) Ano, Akelo.</s>
                <s speaker="Akela" pose="excited">Tak jděte, kluci. Za sedm minut jsem zpátky.</s>
                <removeBackgroundArt art="CourtyardDemo" />
                <addBackgroundArt art="Guardroom1" />
                <s speaker="Vědátor" pose="angry">Mno tahle místnost není tak zajímavá jako nádvoří.</s>
                <s speaker="Tišík" pose="speaking">Ale Akela bude za chvíli zpátky, a budeme moct prozkoumávat zámek.</s>
                <s speaker="Vědátor" pose="excited">Už se těším.</s>
                <s speaker="Tišík" pose="speaking">Nechceš si mezitím zahrát Bifröst?</s>
                <s speaker="Vědátor" pose="excited">Se ptáš? Balíček už mám zamíchaný!</s>
                <s speaker="Vypravěč" pose="angry">Bleh, zase Bifröst. Co vás na té hře baví?</s>
                <s speaker="Tišík" pose="speaking">Bifröst je nejlepší sběratelská karetní hra na světě! Tvůj balíček sestává z hrdinů, mytologických příšer a událostí--</s>
                <s speaker="Vypravěč" pose="shrugging">Stačí, stačí, zapomeňte, že jsem se ptal. Já už se nějak zabavím.</s>
                <think>-- o 30 minut později --</think>
                <s speaker="Tišík" pose="speaking">A nyní zahraju Mrazivé sítě, což posílí moje lukostřelce natolik, aby přemohli tvého draka?</s>
                <s speaker="Vědátor" pose="speaking">Aww, ubohý Nidhogg. Neboj, dráčku, příští kolo tě oživím z mrtvých.</s>
                <s speaker="Vypravěč" pose="thinking">Kluci, nemyslíte, že už sedm minut uplnynulo?</s>
                <s speaker="Vědátor" pose="thinking">...možná?</s>
                <s speaker="Tišík" pose="shrugging">Už jsem Vědátora porazil třikrát, takže asi jo. </s>
                <addBackgroundArt art="Guardroom1LockedGate" />
                <sfx name="PressureRelease"/>
                <sfx name="TrezorOpen"/>
                <s speaker="Tišík" pose="afraid">Haah?</s>
                <s speaker="Vědátor" pose="afraid">Co to bylo?!</s>
                <s speaker="Vypravěč" pose="pointing">Zavřely se dveře!</s>
                <s speaker="Tišík" pose="speaking">Není tu žádná klika.</s>
                <s speaker="Vědátor" pose="afraid">Jsme tady zavření?</s>
                <s speaker="Tišík" pose="speaking">Něco muselo zavřít ty dveře! </s>
                <s speaker="Vědátor" pose="afraid">Možná to byl duch?</s>
                <s speaker="Tišík" pose="speaking">Duch?</s>
                <s speaker="Vědátor" pose="shrugging">Mno, podle něčeho se ten zámek jmenuje Duchov, ne?</s>
                <s speaker="Vědátor" pose="afraid">...</s>
                <s speaker="Vědátor" pose="afraid">Já... se bojím, kluci.</s>
                <s speaker="Tišík" pose="speaking">Já taky, ale --</s>
                <s speaker="Tišík" pose="determined">Ale zvládneme to. Jsme vlčata. Zjistíme, co se tady děje.</s>
                <s speaker="Vypravěč" pose="determined">Jako první bychom se asi měli vrátit nějak na nádvoří.</s>
                <s speaker="Tišík" pose="determined">Ano, prohledejme místnost.</s>
                <s speaker="Tišík" pose="thinking">Někde tu musí být něco, co nás dostane ven.</s>
                <popScene/>
                <popScene/>
                <enqueue bookmark="R1_Guardhouse_Xml_Level" />
            </enter>
        </scene>
    </scenes>
</scene>